{
  "version": "1.0.0",
  "generatedAt": "2025-12-26T13:00:00Z",
  "stats": {
    "totalMethods": 716,
    "tier1Count": 412,
    "tier2Count": 203,
    "tier3Count": 101,
    "categoryCounts": {
      "Core": 10,
      "Dialog": 3,
      "Elements": 11,
      "Families": 28,
      "Views": 18,
      "Sheets": 10,
      "Walls": 11,
      "Doors/Windows": 15,
      "Rooms": 10,
      "Floors": 5,
      "Ceilings": 4,
      "Roofs": 4,
      "Levels": 3,
      "Grids": 5,
      "Text/Tags": 19,
      "RichText": 7,
      "Dimensions": 12,
      "DetailLines": 6,
      "Schedules": 30,
      "Legends": 4,
      "Worksets": 12,
      "Phases": 11,
      "Materials": 9,
      "Parameters": 12,
      "Filters": 7,
      "MEP": 14,
      "Structural": 14,
      "Annotations": 14,
      "Detail": 12,
      "BasePoints": 4,
      "Batch": 3,
      "Capture": 5,
      "Render": 4,
      "Validation": 10,
      "Orchestration": 6,
      "SelfHealing": 9,
      "Links": 5,
      "Revisions": 4,
      "Groups": 5,
      "Site": 4,
      "SheetPatterns": 4,
      "PredictiveIntelligence": 15,
      "Level3Intelligence": 19,
      "Level4Intelligence": 9,
      "Level5Autonomy": 8,
      "Library": 4,
      "LibrarySync": 7,
      "Capability": 11
    }
  },
  "methods": {
    "ping": {"name": "ping", "tier": 1, "category": "Core", "status": "active", "version": "1.0.0", "description": "Health check for MCP connection"},
    "listMethods": {"name": "listMethods", "tier": 1, "category": "Core", "status": "active", "version": "1.0.0", "description": "List all available MCP methods"},
    "getMethodInfo": {"name": "getMethodInfo", "tier": 1, "category": "Core", "status": "active", "version": "1.0.0", "description": "Get detailed info about a method"},
    "getProjectInfo": {"name": "getProjectInfo", "tier": 1, "category": "Core", "status": "active", "version": "1.0.0", "description": "Get current project information"},
    "getOpenDocuments": {"name": "getOpenDocuments", "tier": 1, "category": "Core", "status": "active", "version": "1.0.0", "description": "List open Revit documents"},
    "setActiveDocument": {"name": "setActiveDocument", "tier": 1, "category": "Core", "status": "active", "version": "1.0.0", "description": "Switch active document"},
    "openProject": {"name": "openProject", "tier": 2, "category": "Core", "status": "active", "version": "1.0.0", "description": "Open a Revit project file"},
    "closeProject": {"name": "closeProject", "tier": 2, "category": "Core", "status": "active", "version": "1.0.0", "description": "Close a Revit project"},
    "saveProject": {"name": "saveProject", "tier": 1, "category": "Core", "status": "active", "version": "1.0.0", "description": "Save current project"},
    "saveProjectAs": {"name": "saveProjectAs", "tier": 2, "category": "Core", "status": "active", "version": "1.0.0", "description": "Save project to new location"},

    "getElements": {"name": "getElements", "tier": 1, "category": "Elements", "status": "active", "version": "1.0.0", "description": "Get elements by category"},
    "getElementProperties": {"name": "getElementProperties", "tier": 1, "category": "Elements", "status": "active", "version": "1.0.0", "description": "Get all properties of an element"},
    "getElementLocation": {"name": "getElementLocation", "tier": 1, "category": "Elements", "status": "active", "version": "1.0.0", "description": "Get element location point/curve"},
    "getBoundingBox": {"name": "getBoundingBox", "tier": 1, "category": "Elements", "status": "active", "version": "1.0.0", "description": "Get element bounding box"},
    "deleteElement": {"name": "deleteElement", "tier": 1, "category": "Elements", "status": "active", "version": "1.0.0", "description": "Delete single element"},
    "deleteElements": {"name": "deleteElements", "tier": 1, "category": "Elements", "status": "active", "version": "1.0.0", "description": "Delete multiple elements"},
    "copyElements": {"name": "copyElements", "tier": 1, "category": "Elements", "status": "active", "version": "1.0.0", "description": "Copy elements with offset"},
    "moveElements": {"name": "moveElements", "tier": 1, "category": "Elements", "status": "active", "version": "1.0.0", "description": "Move elements by vector"},
    "rotateElements": {"name": "rotateElements", "tier": 2, "category": "Elements", "status": "active", "version": "1.0.0", "description": "Rotate elements around axis"},
    "mirrorElements": {"name": "mirrorElements", "tier": 2, "category": "Elements", "status": "active", "version": "1.0.0", "description": "Mirror elements across plane"},
    "arrayElements": {"name": "arrayElements", "tier": 2, "category": "Elements", "status": "active", "version": "1.0.0", "description": "Create element array"},

    "getWalls": {"name": "getWalls", "tier": 1, "category": "Walls", "status": "active", "version": "1.0.0", "description": "Get all walls in project"},
    "getWallInfo": {"name": "getWallInfo", "tier": 1, "category": "Walls", "status": "active", "version": "1.0.0", "description": "Get detailed wall information"},
    "getWallsInView": {"name": "getWallsInView", "tier": 1, "category": "Walls", "status": "active", "version": "1.0.0", "description": "Get walls visible in view"},
    "getWallTypes": {"name": "getWallTypes", "tier": 1, "category": "Walls", "status": "active", "version": "1.0.0", "description": "List available wall types"},
    "createWall": {"name": "createWall", "tier": 1, "category": "Walls", "status": "active", "version": "1.0.0", "description": "Create wall from line"},
    "createWallByLine": {"name": "createWallByLine", "tier": 1, "category": "Walls", "status": "active", "version": "1.0.0", "description": "Create wall from line definition"},
    "createWallByPoints": {"name": "createWallByPoints", "tier": 1, "category": "Walls", "status": "active", "version": "1.0.0", "description": "Create wall between two points"},
    "modifyWall": {"name": "modifyWall", "tier": 2, "category": "Walls", "status": "active", "version": "1.0.0", "description": "Modify wall properties"},
    "deleteWall": {"name": "deleteWall", "tier": 1, "category": "Walls", "status": "active", "version": "1.0.0", "description": "Delete a wall"},
    "splitWall": {"name": "splitWall", "tier": 2, "category": "Walls", "status": "active", "version": "1.0.0", "description": "Split wall at point"},
    "joinWalls": {"name": "joinWalls", "tier": 2, "category": "Walls", "status": "active", "version": "1.0.0", "description": "Join two walls"},

    "getDoors": {"name": "getDoors", "tier": 1, "category": "Doors/Windows", "status": "active", "version": "1.0.0", "description": "Get all doors"},
    "getWindows": {"name": "getWindows", "tier": 1, "category": "Doors/Windows", "status": "active", "version": "1.0.0", "description": "Get all windows"},
    "getDoorTypes": {"name": "getDoorTypes", "tier": 1, "category": "Doors/Windows", "status": "active", "version": "1.0.0", "description": "List door types"},
    "getWindowTypes": {"name": "getWindowTypes", "tier": 1, "category": "Doors/Windows", "status": "active", "version": "1.0.0", "description": "List window types"},
    "placeDoor": {"name": "placeDoor", "tier": 1, "category": "Doors/Windows", "status": "active", "version": "1.0.0", "description": "Place door in wall"},
    "placeWindow": {"name": "placeWindow", "tier": 1, "category": "Doors/Windows", "status": "active", "version": "1.0.0", "description": "Place window in wall"},
    "modifyDoor": {"name": "modifyDoor", "tier": 2, "category": "Doors/Windows", "status": "active", "version": "1.0.0", "description": "Modify door properties"},
    "modifyWindow": {"name": "modifyWindow", "tier": 2, "category": "Doors/Windows", "status": "active", "version": "1.0.0", "description": "Modify window properties"},
    "deleteDoorWindow": {"name": "deleteDoorWindow", "tier": 1, "category": "Doors/Windows", "status": "active", "version": "1.0.0", "description": "Delete door or window"},

    "getRooms": {"name": "getRooms", "tier": 1, "category": "Rooms", "status": "active", "version": "1.0.0", "description": "Get all rooms"},
    "createRoom": {"name": "createRoom", "tier": 1, "category": "Rooms", "status": "active", "version": "1.0.0", "description": "Create room at point"},
    "modifyRoom": {"name": "modifyRoom", "tier": 2, "category": "Rooms", "status": "active", "version": "1.0.0", "description": "Modify room properties"},
    "deleteRoom": {"name": "deleteRoom", "tier": 1, "category": "Rooms", "status": "active", "version": "1.0.0", "description": "Delete a room"},
    "createRoomBoundary": {"name": "createRoomBoundary", "tier": 2, "category": "Rooms", "status": "active", "version": "1.0.0", "description": "Create room separation line"},
    "getRoomBoundaries": {"name": "getRoomBoundaries", "tier": 1, "category": "Rooms", "status": "active", "version": "1.0.0", "description": "Get room boundary lines"},
    "tagRoomsInView": {"name": "tagRoomsInView", "tier": 1, "category": "Rooms", "status": "active", "version": "1.0.0", "description": "Tag all rooms in view"},
    "getRoomFinishes": {"name": "getRoomFinishes", "tier": 1, "category": "Rooms", "status": "active", "version": "1.0.0", "description": "Get room finish parameters"},
    "setRoomFinishes": {"name": "setRoomFinishes", "tier": 2, "category": "Rooms", "status": "active", "version": "1.0.0", "description": "Set room finish parameters"},
    "createRoomSeparationLine": {"name": "createRoomSeparationLine", "tier": 2, "category": "Rooms", "status": "active", "version": "1.0.0", "description": "Create room separation line"},

    "getViews": {"name": "getViews", "tier": 1, "category": "Views", "status": "active", "version": "1.0.0", "description": "Get all views"},